<?xml version="1.0"?>
<xs:schema version="1.0"
           xmlns:xs="http://www.w3.org/2001/XMLSchema"
           targetNamespace="https://www.artiigo.com"
           xmlns = "https://www.artiigo.com"
           elementFormDefault="qualified">
    <xs:element name="hiv">
        <xs:complexType>
            <xs:sequence>
                <xs:element name="data" maxOccurs="unbounded">
                    <xs:complexType>
                        <xs:sequence>
                            <xs:element name="country" type="xs:string"/>
                            <xs:element name="year" type="xs:string"/>
                            <xs:element name="display" type="xs:string"/>
                        </xs:sequence>
                    </xs:complexType>
                </xs:element>
            </xs:sequence>
        </xs:complexType>
    </xs:element>
</xs:schema>
